<?xml version="1.0" encoding="UTF-8"?>
<!DOCTYPE cia SYSTEM "cia.dtd">
<cia>
	<countries>
		<country id="01US000" region ="CNA" nation = "JP" government_type = "GT02" organisation ="OON NAFTA NATO">
			<name>Съединени Американски Щати</name>
			<image_flag>usa_flag.png</image_flag> 
			<image_blazon>usa_blazon.png</image_blazon> 
			<capital>Вашингтон</capital>
			<anthem>
				<song>
					<title>Знаме, обсипано със звезди</title>
					<author>Знаме, обсипано със звезди</author>
					<year>1931</year>
				</song>
			</anthem>
		</country>
		<country id="01MX000" region ="SNA" nation = "MX" government_type = "GT02" organisation ="OON NAFTA">
			<name>Мексико</name>
			<image_flag>mexico_flag.png</image_flag> 
			<image_blazon>mexico_blazon.png</image_blazon> 
			<capital>Мексико</capital>
			<anthem>
				<song>
					<title>Национален химн на Мексико</title>
					<author>Знаме, обсипано със звезди</author>
					<year>1931</year>
				</song>
			</anthem>
		</country>
	
	</countries>	
	
	<regions>
		<region con_id="CNA">
			<continent>Централна Северна Америка</continent>
			<climate>Умерено континентален</climate>
			<timezone>UTC-9</timezone>
		</region>
		
		<region con_id="SNA">
			<continent>Южна Северна Америка</continent>
			<climate>Умерено континентален</climate>
			<timezone>UTC-9</timezone>
		</region>
		
		
	</regions>
	
	<nations>
		<nation nat_id="MX">
			<demonym>Мексиканци</demonym>
			<population>127 094 745</population>
			<language>испански</language>
			<religion>католицизъм</religion>
		</nation>
		
		<nation nat_id="US">
		
			<demonym>Американци</demonym>
			<population>308 745 538</population>
			<language>английски</language>
			<religion>християнство</religion>
		</nation>
		
	</nations>
	
<government_types>
		<government_type gov_id = "GT01">
			<type>Република</type>
		</government_type>
		
		<government_type gov_id = "GT02">
			<type>Президентска република</type>
		</government_type>
		
		<government_type gov_id = "GT03">
			<type>Парламентарна република</type>
		</government_type>
		
		<government_type gov_id = "GT04">
			<type>Полупрезидентска република</type>
		</government_type>
		
		<government_type gov_id = "GT05">
			<type>Монархия</type>
		</government_type>
		
		<government_type gov_id = "GT06">
			<type>Абсолютна монархия</type>
		</government_type>
		
		<government_type gov_id = "GT07">
			<type>Конституционна монархия</type>
		</government_type>
		
		<government_type gov_id = "GT08">
			<type>Дуалистична монархия</type>
		</government_type>
		
		<government_type gov_id = "GT09">
			<type>Парламентарна монархия</type>
		</government_type>
	</government_types>
	
	<organisations>
		<organisation org_id="NATO">
			<org_name>НАТО</org_name>
			<year_establishment>1949</year_establishment>
		</organisation>
		
		<organisation org_id="ES">
			<org_name>Европейски съюз</org_name>
			<year_establishment>1958</year_establishment>
		</organisation>
		
		<organisation org_id="NAFTA">
			<org_name>Северноамериканското споразумение за свободна търговия</org_name>
			<year_establishment>1994</year_establishment>
		</organisation>
		
		<organisation org_id="BU">
			<org_name>Британската общност</org_name>
			<year_establishment></year_establishment>
		</organisation>
		
		<organisation org_id="AU">
			<org_name>Африкански съюз</org_name>
			<year_establishment>2002</year_establishment>
		</organisation>
		
		<organisation org_id="OON">
			<org_name>Организацията на обединените нации</org_name>
			<year_establishment>1945</year_establishment>
		</organisation>
		
		<organisation org_id="BRICS">
			<org_name>БРИКС</org_name>
			<year_establishment>2009</year_establishment>
		</organisation>
		
		<organisation org_id="CPLP">
			<org_name>Организация на португалско говорящите държави</org_name>
			<year_establishment>1996</year_establishment>
		</organisation>
		<organisation org_id="SHEN">
			<org_name>Шенгенско пространство</org_name>
			<year_establishment>1985</year_establishment>
		</organisation>
		<organisation org_id="STO">
			<org_name>Световна търговска организация</org_name>
			<year_establishment>1995</year_establishment>
		</organisation>
</organisations>
	
</cia>
